{
  "contract_package_revision": "sha256:1fa372e1fc4eafe5b819aedd29f258732b8a53fab6b9559e964f6ee1164a4fe3",
  "parameter_descriptor_schema_identity": "tilesim.bridge.agent_orchestration_parameter_descriptor.v1",
  "parameter_descriptor_schema_revision": "sha256:838b23942c1946f3857faf730449a19df4aa07c13d91d7e7db11bf690f6d8194",
  "parameter_descriptor_schema_digest": "sha256:838b23942c1946f3857faf730449a19df4aa07c13d91d7e7db11bf690f6d8194",
  "parameter_descriptors": [
    {
      "field_id": "s0.workload.message_size_multiplier",
      "owner_module": "工作负载抽象与负载描述语言模块",
      "value_type": "number",
      "canonical_unit": "ratio",
      "accepted_units": ["ratio"],
      "constraints": {
        "minimum": "0.25",
        "maximum": "8.0"
      },
      "applicability": {
        "status": "available",
        "conditions": ["scenario=s1_des_example", "input_mode=controls"]
      },
      "request_identity": "tilesim.bridge.create_run_request.v1",
      "request_json_pointer": "/overrides/workload/message_size_multiplier",
      "lowering_stage": "Bridge materialize_inputs -> input-runtime-trace message_size_bytes -> 后端通信 demand",
      "execution_evidence": [
        {
          "repository": "D:/tileSim",
          "revision": "7e5a8c6a5cf738bd24608b440a61b62dee8d1881",
          "path": "tests/test_week4_cumulative_flow.cpp",
          "test_case": "larger-message differential",
          "evidence_class": "synthetic_deterministic_execution",
          "artifact_pointers": [
            "input-runtime-trace.json:/requests/*/message_size_bytes",
            "execution-envelope.json:/end_time_ps",
            "metrics.json:/request_metrics"
          ]
        }
      ],
      "capability_state": {
        "described": {
          "state": "affirmed",
          "reason_code": "execution_closure_proven"
        },
        "accepted": {
          "state": "affirmed",
          "reason_code": "execution_closure_proven"
        },
        "validated": {
          "state": "affirmed",
          "reason_code": "execution_closure_proven"
        },
        "lowered": {
          "state": "affirmed",
          "reason_code": "execution_closure_proven"
        },
        "executed": {
          "state": "affirmed",
          "reason_code": "execution_closure_proven"
        },
        "observable": {
          "state": "affirmed",
          "reason_code": "execution_closure_proven"
        },
        "calibrated": {
          "state": "denied",
          "reason_code": "calibration_missing"
        },
        "held_out_validated": {
          "state": "denied",
          "reason_code": "held_out_validation_missing"
        },
        "agent_exposed": {
          "state": "affirmed",
          "reason_code": "execution_closure_proven"
        }
      },
      "reason_codes": ["execution_closure_proven", "calibration_missing", "held_out_validation_missing"],
      "claim_scope_ceiling": ["exploration", "synthetic_consistency"],
      "resolved_fidelity": "mixed"
    },
    {
      "field_id": "s1.runtime.batch_scheduler",
      "owner_module": "推理引擎与服务运行时模块",
      "value_type": "enum",
      "canonical_unit": "scheduler_policy",
      "accepted_units": ["scheduler_policy"],
      "constraints": {
        "enum": ["fifo", "decode_priority", "fabric_backpressure_aware"]
      },
      "applicability": {
        "status": "available",
        "conditions": ["scenario=s1_des_example", "input_mode=controls"]
      },
      "request_identity": "tilesim.bridge.create_run_request.v1",
      "request_json_pointer": "/overrides/runtime/batch_scheduler",
      "lowering_stage": "Bridge runtime policy -> RuntimeBatchLowering deterministic planner",
      "execution_evidence": [
        {
          "repository": "D:/tileSim",
          "revision": "7e5a8c6a5cf738bd24608b440a61b62dee8d1881",
          "path": "tests/test_runtime_batch_lowering.cpp",
          "test_case": "fifo versus decode-priority ordering",
          "evidence_class": "synthetic_deterministic_execution",
          "artifact_pointers": [
            "input-runtime-trace.json:/policy/batch_scheduler",
            "execution-envelope.json:/stages",
            "metrics.json:/request_metrics"
          ]
        }
      ],
      "capability_state": {
        "described": {
          "state": "affirmed",
          "reason_code": "execution_closure_proven"
        },
        "accepted": {
          "state": "affirmed",
          "reason_code": "execution_closure_proven"
        },
        "validated": {
          "state": "affirmed",
          "reason_code": "execution_closure_proven"
        },
        "lowered": {
          "state": "affirmed",
          "reason_code": "execution_closure_proven"
        },
        "executed": {
          "state": "affirmed",
          "reason_code": "execution_closure_proven"
        },
        "observable": {
          "state": "affirmed",
          "reason_code": "execution_closure_proven"
        },
        "calibrated": {
          "state": "denied",
          "reason_code": "calibration_missing"
        },
        "held_out_validated": {
          "state": "denied",
          "reason_code": "held_out_validation_missing"
        },
        "agent_exposed": {
          "state": "affirmed",
          "reason_code": "execution_closure_proven"
        }
      },
      "reason_codes": ["execution_closure_proven", "calibration_missing", "held_out_validation_missing"],
      "claim_scope_ceiling": ["exploration", "synthetic_consistency"],
      "resolved_fidelity": "mixed"
    },
    {
      "field_id": "s1.runtime.max_batch_size",
      "owner_module": "推理引擎与服务运行时模块",
      "value_type": "integer",
      "canonical_unit": "requests_per_batch",
      "accepted_units": ["requests_per_batch"],
      "constraints": {
        "minimum": "1",
        "maximum": "64",
        "step": "1"
      },
      "applicability": {
        "status": "available",
        "conditions": ["scenario=s1_des_example", "input_mode=controls"]
      },
      "request_identity": "tilesim.bridge.create_run_request.v1",
      "request_json_pointer": "/overrides/runtime/max_batch_size",
      "lowering_stage": "Bridge runtime policy -> RuntimeBatchLowering batch membership",
      "execution_evidence": [
        {
          "repository": "D:/tileSim",
          "revision": "7e5a8c6a5cf738bd24608b440a61b62dee8d1881",
          "path": "tests/test_runtime_batch_lowering.cpp",
          "test_case": "multi-request batch membership",
          "evidence_class": "synthetic_deterministic_execution",
          "artifact_pointers": [
            "input-runtime-trace.json:/policy/max_batch_size",
            "execution-envelope.json:/runtime_event_count",
            "metrics.json:/request_metrics"
          ]
        }
      ],
      "capability_state": {
        "described": {
          "state": "affirmed",
          "reason_code": "execution_closure_proven"
        },
        "accepted": {
          "state": "affirmed",
          "reason_code": "execution_closure_proven"
        },
        "validated": {
          "state": "affirmed",
          "reason_code": "execution_closure_proven"
        },
        "lowered": {
          "state": "affirmed",
          "reason_code": "execution_closure_proven"
        },
        "executed": {
          "state": "affirmed",
          "reason_code": "execution_closure_proven"
        },
        "observable": {
          "state": "affirmed",
          "reason_code": "execution_closure_proven"
        },
        "calibrated": {
          "state": "denied",
          "reason_code": "calibration_missing"
        },
        "held_out_validated": {
          "state": "denied",
          "reason_code": "held_out_validation_missing"
        },
        "agent_exposed": {
          "state": "affirmed",
          "reason_code": "execution_closure_proven"
        }
      },
      "reason_codes": ["execution_closure_proven", "calibration_missing", "held_out_validation_missing"],
      "claim_scope_ceiling": ["exploration", "synthetic_consistency"],
      "resolved_fidelity": "mixed"
    },
    {
      "field_id": "s1.runtime.kv_capacity_tokens",
      "owner_module": "推理引擎与服务运行时模块",
      "value_type": "integer",
      "canonical_unit": "tokens",
      "accepted_units": ["tokens"],
      "constraints": {
        "minimum": "256",
        "maximum": "1000000",
        "step": "1"
      },
      "applicability": {
        "status": "conditional",
        "conditions": ["scenario=s1_des_example", "input_mode=controls", "logical_admission_only", "GAP-KV-001"]
      },
      "request_identity": "tilesim.bridge.create_run_request.v1",
      "request_json_pointer": "/overrides/runtime/kv_capacity_tokens",
      "lowering_stage": "Bridge runtime policy -> RuntimeBatchLowering logical KV admission state",
      "execution_evidence": [
        {
          "repository": "D:/tileSim",
          "revision": "7e5a8c6a5cf738bd24608b440a61b62dee8d1881",
          "path": "tests/test_runtime_batch_lowering.cpp",
          "test_case": "KV pressure and admission cases",
          "evidence_class": "synthetic_deterministic_execution",
          "artifact_pointers": [
            "input-runtime-trace.json:/policy/kv_capacity_tokens",
            "execution-envelope.json:/stages",
            "validation.json:/checks"
          ]
        }
      ],
      "capability_state": {
        "described": {
          "state": "affirmed",
          "reason_code": "execution_closure_proven"
        },
        "accepted": {
          "state": "affirmed",
          "reason_code": "execution_closure_proven"
        },
        "validated": {
          "state": "affirmed",
          "reason_code": "execution_closure_proven"
        },
        "lowered": {
          "state": "affirmed",
          "reason_code": "execution_closure_proven"
        },
        "executed": {
          "state": "affirmed",
          "reason_code": "gap_kv_001_logical_admission_only"
        },